{
  "schema": 1,
  "tool": "WebFetch",
  "url": "https://www.sqlite.org/wal.html",
  "fetch_prompt": "How does checkpointing work?",
  "http_code": 200,
  "bytes": 48213,
  "duration_ms": 812,
  "status": "ok",
  "summary": "A checkpoint copies WAL frames back.",
  "results": [],
  "agent": "codex",
  "source": "import",
  "created_at": 1790906400,
  "share": "full"
}
