{"schema":1,"tool":"WebSearch","query":"sqlite fts5 bm25 ranking","duration_ms":812,"status":"ok","summary":"Results describe bm25().","results":[{"rank":1,"url":"https://sqlite.org/fts5.html","title":"SQLite FTS5 Extension"},{"rank":2,"url":"https://example.com/bm25"}],"agent":"codex","source":"import","created_at":1790920800,"repo_key":"0123456789abcdef0123456789abcdef","share":"full"}
